,Subreddit,Top
0,funny,Guardians of the Front Page
1,pics,"Thanks, Obama."
2,gaming,"Take your time, you got this"
3,news,Blizzard Employees Staged a Walkout After the Company Banned a Gamer for Pro-Hong Kong Views
4,pics,"This is Shelia Fredrick, a flight attendant. She noticed a terrified girl accompanied by an older man. She left a note in the bathroom on which the victim wrote that she needed help. The police was alerted & the girl was saved from a human trafficker. We should honor our heroes."
5,pics,DEMOCRACY NOW
6,pics,I got a cease and desist for making the Crocs Gloves
7,funny,Printers
8,memes,I drew all the boys together and i did it for the internet
9,gifs,1 dad reflex 2 children
10,aww,The dog is supposed to run up in front of her and sit.
11,gifs,Guy Naruto Runs Past News Anchor for Storm Area 51
12,gifs,"Tear gas canisters filmed raining in Hong Kong - against all regulations, while police deny firing from height"
13,pics,Protestor in Hong Kong today
14,pics,This image of Xi Jiping as Winnie the Pooh is illegal in mainland China
15,funny,Irish man leaves funny recording for his funeral!
16,aww,This is Tiger. He just turned 31. We are told he is the oldest cat in the state of Illinois
17,news,"Jeffrey Epstein, accused sex trafficker, dies by suicide: Officials"
18,pics,The moment this jogger realized he stumbled into my friends’ engagement photo
19,memes,Simpsons predicted it yet again
20,PewdiepieSubmissions,🎉CONGRATULATIONS FELIX & MARZIA 🎉
21,YouFellForItFool,You fell for it fool!
22,wholesomememes,What a considerate man
23,funny,Middle child asserting dominance over all others
24,pics,"Growing up, other kids used to make fun of me because I looked like the original Bob the Builder. While working in the field, they gave us these hard hats so I thought I’d take a selfie for the boys back home."
25,pics,"Friendly reminder that China is running concentration camps and interning up to an estimated 3 million people who are being brainwashed with communist propaganda, tortured, raped, humiliated, used as medical guinea pigs, sterilised, and executed for their organs"
26,interestingasfuck,Protestors in Hong Kong are cutting down facial recognition towers.
27,aww,Monkeybro helps out
28,aww,I'm babysitting my friend's cat and did a photoshoot for her
29,aww,Every year this mama duck brings her babies to my house and I help her take care of them. This morning I opened my door to 13 new peeping fluff balls.
30,pics,Should have been Bernie
31,worldnews,"2.6 terabyte leak of Panamanian shell company data reveals ""how a global industry led by major banks, legal firms, and asset management companies secretly manages the estates of politicians, Fifa officials, fraudsters and drug smugglers, celebrities and professional athletes."""
32,pics,8 years clean from heroin today
33,interestingasfuck,It's snowing in Australia at the moment and its not every day that you get to see Kangaroos hopping in the snow.
34,funny,So inspiring
35,aww,Every year a bobcat mama gives birth to a litter of kittens on my roof. I set up a camera this time around.
36,pics,The full Tiananmen Square Tank Man picture is so much more powerful than the cropped one
37,aww,Looking at my cameras during a business trip. When suddenly....
38,memes,For real though
39,DunderMifflin,I was without internet for a while. Decided to use my talents to make Deangelo actually juggle balls.
40,pics,Censorship Bad
41,Showerthoughts,"Everyone hates being sung happy birthday, and everyone hates singing happy birthday, so what the fuck are we doing here."
42,interestingasfuck,The protest rally in Hong Kong right now (source: twitter)
43,pics,Hope #trashtag is still on
44,pics,"Spotted in Hong Kong: «Hear HK now, or be Hong Kong soon»"
45,pics,This image is illegal in China. Tiananmen Square 1989 massacre
46,freefolk,"30,000 up-votes and this becomes a Lord of The Rings subreddit"
47,funny,Guy wakes up in the wrong house!
48,memes,Actual Air Force Brief My Cousin Had to Sit Through
49,assholedesign,Youtuber gets every single video on his channel copyright claimed despite having the rights to all the music in his videos
